{
  "$schema": "../schemas/agent.schema.json",
  "schemaVersion": 1,
  "name": "ResourceAgent",
  "worldId": "my-test-world",
  "tickIntervalMs": 1000,
  "rules": [
    {
      "id": "eat-first",
      "priority": 100,
      "description": "First eat, If hunger is lower 16.",
      "when": { "all": [{ "fact": "/self/food", "lt": 16 }, { "fact": "/inventory/minecraft:bread", "gt": 0 }] },
      "action": { "skill": "eat", "args": { "item": "minecraft:bread" } }
    },
    {
      "id": "collect-wood",
      "priority": 10,
      "description": "Collect a supply of four oak logs.",
      "when": { "fact": "/inventory/minecraft:oak_log", "lt": 4 },
      "action": { "skill": "gather", "args": { "block": "minecraft:oak_log", "count": 1 } }
    }
  ]
}
